img_id,caption_id,sent
317330,405405,Мужчина смотрит поверх очков в галстуке и подтяжках.
111347,525958,"Малыш улыбается перед игрушечным поездом, стоящим на столе."
384242,455129,Человек в океане устанавливает доску для виндсерфинга.
83013,33877,Слон гуляет по своему загону у всех на виду.
272599,593483,Мужчина держится за доску для серфинга и плывет.
455666,263911,Молодой человек в официальной одежде позирует перед камерой.
373768,453523,Два мальчика играют в игры Wii по телевизору.
462324,810037,мужчина скейтбордист в белой рубашке делает трюк
504747,333173,Женщина стоит на кухне и готовит еду.
116434,270631,"Силуэт человека, плывущего по волнам."
92894,423148,Бейсболист становится в стойку для отбивания мяча.
37783,272840,Мальчик катается на скейтборде по рампе.
63965,318929,"Женщина держит тарелку с тортом, покрытым глазурью."
5032,206848,Женщина и ребенок стоят на лыжах в снегу.
85527,439728,Мужчина в смокинге держит пиво
330911,735339,Человек летит по воздуху во время катания на сноуборде.
370208,731512,Велосипед припаркован перед парковочным счетчиком.
443053,38064,молодой человек катается на доске для серфинга на волне
331604,219543,Кайтсерфер в воздухе на красной доске.
418625,183151,Две зебры лежат на земле рядом друг с другом.
462031,773286,Мужчина держит биту на поле под фонарем.
174633,383675,Взрослый на лыжах держит за руку ребенка на лыжах.
42752,634861,мужчина сидит лицом к большому окну
105960,77257,Виндсерфер в океане на фоне пляжа.
88360,318860,Две женщины играют друг против друга во фрисби.
481895,610516,Два серфера катаются на волнах недалеко от пляжа.
248786,782719,Группа людей в ресторане хорошо проводит время и наслаждается пиццей
217654,442950,Мужчина летит высоко в воздухе во время виндсерфинга.
234518,323876,Девушка ловит брошенную ей красную фрисби.
478906,378191,"Три человека улыбаются и позируют, стоя вместе."
114481,573118,Бейсболист стоит рядом с базой.
212663,226656,Автобус припарковался рядом с другим автобусом на автобусной остановке.
233090,274573,Лодка плывет в гавани очень большого города.
422274,495495,Человек катается на доске для серфинга по воде.
168353,782333,пара человек разрезают торт
404847,677052,Группа людей с зонтами на дороге.
451879,475764,"Бейсболисты во время игры, один человек, одетый в зеленое, бежит, а другие в белом смотрят и тянутся к мячу."
477144,547615,Бейсболист стоит рядом с домашней базой и держит биту.
484681,3007,Маленький мальчик улыбается в камеру и тянет рюкзак.
403675,755328,Парень с бейсбольной битой готов играть 
143120,478839,Мужчина держит печенье или пончик рядом со ртом.
310445,391429,Люди сидят за столом и едят
342204,490795,Пара женщин едят вместе.
54344,522343,Люди готовятся к посадке в легкий самолет на взлетно-посадочной полосе.
262394,100797,Мотоцикл припаркован вдоль улицы рядом со зданием.
355513,32158,"Мужчина стоит на сноуборде у леса,"
186218,274363,Двое мужчин снаружи с пальто и зонтиками.
58651,167229,Зеленый поезд проходит через депо.
225405,73722,Два мальчика играют с футбольным мячом.
490620,477788,Маленькая девочка сидит у свежеприготовленной пиццы.
296524,676086,Мужчина поправляет галстук с расплывчатой ​​рукой.
115765,268772,Группа молодых женщин стоит под деревьями в парке.
116341,226755,Группа детей сидит за столом и ест кусочки торта.
463690,66080,Мужчина лежит на тротуаре с одной ногой в воздухе.
355394,73034,Серфер катается на волне в зеленом океане.
224114,567059,Курортный отель с зонтиками и шезлонгами.
307531,493704,собака бежит к фрисби в воздухе
473250,459747,"картина женщины, держащей красный зонт"
20070,60957,Мужчина с феном в маленькой ванной
320944,685970,Толпа людей идет по улице.
419444,436626,Молодой человек катается на скейтборде в наушниках.
379144,47252,Синий самосвал едет по шоссе.
188866,690907,Девушка сидит с пончиком в руке.
65655,815215,группа людей сидит за столом с тарелками с едой
258395,712380,Красная пожарная машина едет по улице.
200058,563993,Человек на сноуборде в снегу.
190637,88188,маленький ребенок лежит в постели и играет в nintendo wii
346642,574297,"Лагуна с кристально чистой водой, наполненная лодками."
134322,96999,"Полет воздушного змея между акваторией и строительным комплексом, вероятно, Япония."
539874,712000,Мужчина в красно-черном галстуке.
537069,475392,Мальчик бьет битой по мячу.
391222,433850,Две лыжницы стоят на снегу в фиолетовых костюмах.
324340,416782,Женщина держит в одной руке три яблока.
477500,807115,Два человека сидят на мопедах на улице.
434488,693005,Башня с часами и небоскреб рядом с ней.
556248,472605,Птицы гуляют по большой скале у океана
559047,610152,Кошка сидит на деревянном сиденье.
37907,472464,кошка лежит на разной электронике
87377,246997,красивая кошка прячется внутри коричневого чемодана
380117,78607,Кот лежит свернувшись калачиком на столе в окружении зелени.
87595,518807,Белый кот сидит на кровати рядом с тумбочкой.
503668,414369,Лохматая собака лежит на зеленом и синем одеяле.
181763,180638,Черно-белая собака в белой шляпе.
135748,258893,"Крошечная собака в собачьей постели, покрытая одеялом."
515668,147653,Собака гоняется за белой фрисби в грязном травяном парке.
206831,714576,Большая коричневая собака держит во рту неоновую фрисби.
137321,508026,Над кроватью свесился мужчина с низко опущенной головой.
349776,225276,Собака стоит рядом с кошкой в ​​грязном поле.
29170,146278,Лошадь на пустынном песчаном пляже с зонтиками.
578902,699150,Группа лошадей в поле с пегой лошадью на переднем плане.
368088,494887,Стадо лошадей стоит на берегу у воды
384513,562717,маленькая лошадь привязана к телеге на обочине дороги
129637,790835,Фигурки лошадей рядом с прогулкой по столу.
74460,737980,пара лошадей пасется на зеленой траве
345209,74335,Детеныш лошади пьет молоко своей матери.
460682,701597,лошадь лежит в поле
274091,82454,"Улица с кирпичными домами, британскими флагами и башней с часами."
369849,302077,Три лошади пасутся на траве возле уличного знака.
242342,102662,Две лошади вместе бегут по травянистому полю
23937,701648,маленькая овца лежит в поле
572408,305022,Корова стоит в поле с коровой поменьше.
361123,114119,Овца в снегу с другими овцами вокруг нее.
437931,640543,Стадо овец стоит на покрытом травой поле.
517795,198562,две овцы рядом с деревянной конструкцией за забором
191533,101378,Две овцы пасутся в зеленом поле с деревьями на заднем плане.
374100,544197,Две коровы в поле смотрят в камеру.
237566,111229,Две черные коровы пасутся на травянистом поле
310618,326535,Корова пытается набрать воды из протекающей трубы.
316112,158226,большая группа разбросанных по полю овец.
92145,480808,Несколько очень красивых коричневых коров едят возле забора.
213961,597283,Две коровы гуляют по песчаным дюнам на пляже.
545958,671544,Корова стоит возле белого здания с синим входом.
129416,792878,Группа коров пасется в поле возле водоема.
361268,346464,Корова пасется на траве на обочине тротуара.
339512,412522,"Молочные коровы выстраиваются в очередь у забора, чтобы пастись на более сладкой траве."
167193,414371,Две коровы бодаются на пастбище.
116095,639064,"В ряд идут четыре коричневых и белых коровы, а за ними еще пара."
87444,154871,Корова сидит в загоне внутри здания.
539784,644822,У оживленной дороги пасется большое стадо овец.
66800,488445,Слон стоит в траве.
108326,741718,"Большая картина, на которой зебры и свиньи стоят рядом с оленями."
108864,339290,Два слона скрещивают бивни в противостоянии в поле
94538,219262,Три слона и зебра вместе стоят на улице.
69928,590059,Статуя слона висит на стене здания.
359135,414469,Два слона играют друг с другом и сцепляются бивнями.
519461,579416,пара слонов стоит в загоне
11364,523448,Черный медведь идет по зеленому полю.
254479,108108,маленький медвежонок стоит между ветвями дерева
328499,781146,Бурый медвежонок и енот едят ягоды в лесу.
407019,652318,Белый медведь ходит около воды
98197,660644,Молодой черный медведь идет по травянистому полю.
539678,559876,Медведь сидит один на траве.
204381,763452,Белый полярный медведь стоит возле ветки дерева.
256091,489688,Группа зебр стоит в пустыне.
416193,424097,Поле с зебрами и жирафами в зоопарке.
38825,798293,Две зебры пасутся вместе в травянистой местности.
187434,549861,Пара зебр стоят на зеленом поле.
371243,724395,пара зебр идут по полю
85285,799558,"крупный план зебры, идущей по земле"
63381,319594,одинокая зебра стоит у камней и ест траву
105670,340761,"Вид на заднюю часть зебры, когда она идет."
512468,583425,зебра и некоторые другие животные на тропе
42534,483345,«Портретный снимок» зебры на резком фоне.
374486,544678,Два жирафа стоят вместе в поле.
352576,406866,Жираф стоит в лесу.
92109,751780,голова жирафа изображена на красочной фотографии
432529,461052,два жирафа стоят очень близко друг к другу
393282,532995,Два жирафа стоят посреди поля.
580693,562006,Жирафы сидят на сухом травяном поле днем
116289,317074,Два жирафа стоят рядом друг с другом около дерева.
165336,218690,Два жирафа стоят рядом друг с другом на поле.
442894,50409,Два жирафа в зоопарке на фоне стены с рисунком поля.
118401,451415,Жираф и несколько слонов у кромки воды.
155546,637366,В гостиной возле обеденного стола стоит кожаный диван.
534121,580039,Диван и стул в маленькой комнате.
284375,226746,Открытый ноутбук стоит на деревянном столе.
82258,450055,Несколько книг сложены на столе.
454907,196066,"Кухня с плитой, духовкой и холодильником."
314935,416073,Два ноутбука стоят на коричневом столе.
441225,413970,Ванная комната с ванной и двумя раковинами.
436470,123258,"гостиная с диванами, стульями и столом"
567657,84895,Компьютерный стол с ноутбуком и настольным компьютером.
47597,168925,Часы стоят поверх нескольких книг.
509260,706593,Старый телевизор показывает старую компьютерную игру перед двумя книжными стеллажами.
80045,479228,Большие уличные часы с двумя циферблатами и различными рисунками и цифрами на циферблатах.
414676,734871,Очень высокая кирпичная башня с часами по бокам.
242615,48728,Две аккуратно заправленные кровати в комнате.
294305,763236,Двое часов на вершине башни в ночное время.
163798,628207,Башня с часами рядом с большим зданием.
400922,108960,Вывеска висит на стене над часами.
169273,88853,Часы на старом каменном здании рядом с окном
413497,376354,"Большие часы, установленные на стене каменного здания"
577821,570176,Старая башня с часами с римскими цифрами и колоколами.
414340,122609,Большая башня с часами рядом с маленькой белой церковью.
105455,97045,Красочная башня с часами на улице.
414663,770474,Часы с фонарями на тротуаре возле белого здания.
3084,666732,синий циферблат с золотыми цифрами в кирпичном здании
133195,520477,очень высокое здание с городскими часами на нем
521181,84714,"В спальне большая кровать, покрытая одеялом."
228464,317092,Фотография здания с акцентом на часы.
264730,2048,Часы на стене в городе.
271548,36714,Стеклянная ваза с белыми цветами.
283064,716335,"Стол с огромной стеклянной вазой, в которой стоят искусственные цветы."
500825,465840,Цветы стоят в высокой прозрачной вазе с водой.
220137,122398,Крытый сад с голубыми вазами и соломенной беседкой.
309405,344828,"Гостиная с красным стулом и пуфиком, столом и телевизором."
223671,537337,небольшая гостиная со стульями и пуфом
56443,699396,Черно-белый натюрморт ветки с цветами в вазе
140076,787422,Накрытый обеденный стол с цветочной вазой на столе.
88445,648789,украшенная ваза стоит на столешнице
239306,433905,Три сине-белые вазы на полке на узорчатом фоне.
262360,671262,Ваза с цветами и водой на столе.
435075,541767,Ваза наполнена множеством разноцветных цветов.
508115,482318,"Плюшевый мишка сидит у цветка, кофейного мешка и религиозной статуи."
181947,152145,Чашка с тремя парами ножниц на столе.
116226,631197,"пара желтых ножниц, половник и прихватки"
161008,303279,Ножницы лежат на деревянном ящике.
198992,256203,Пара красных ножниц на белой поверхности.
498363,60149,"Ножницы прикованы цепями, чтобы их не украли."
348012,611516,Ножницы лежат на рулоне клейкой ленты.
232596,336944,Куча отрезанных волос поверх расчески и ножниц.
348083,485345,комната с диванами и столом внутри
122602,86364,Стол с ножницами и бутылкой клея рядом с доской.
318730,621557,Ножницы перерезают кусок веревки.
81354,446368,Крупный план ржавых ножниц и гаечного ключа.
237844,476305,Ноутбук стоит на столе с другими аксессуарами.
194425,111174,"Камень, ножницы и бумага в виде статуи."
421069,536219,Ножницы и буклет на столе
564283,199806,Белый холодильник с морозильной камерой на кухне.
34080,729521,Маленькие ножницы лежат рядом с копейкой.
425905,352981,Ножницы торчат из деревянного стола.
288161,503820,кухня с электроприбором над раковиной
481890,524555,Большой белый мишка лежит на кровати с подушками.
4396,756284,плюшевый мишка в зеленом халате
175443,669925,Рождественская елка с огнями и плюшевым мишкой
328745,130171,Два коричневых мишки сидят на кровати в черно-белую клетку.
73453,829306,маленький плюшевый мишка стоит на столе рядом с шоколадным десертом
523315,662720,Коричневый плюшевый мишка сидит возле подушки
343534,762309,кукла держится за руки с двумя плюшевыми мишками
139277,34596,Крупный план очень маленького плюшевого мишки.
43073,441233,Мальчик в синей рубашке стоит рядом с женщиной.
48850,55526,Стол с двумя стульями с розовым феном наверху.
574250,207899,"Шкаф, наполненный одеждой, рядом с белой кроватью."
178028,556990,Раковина в ванной комнате с большим зеркалом и феном на стене.
293133,280841,Маленькая девочка помогает высушить волосы другому ребенку.
338094,502277,Женщина в гостиной сушит волосы вниз головой.
27570,774300,Женщина сушит волосы феном перед зеркалом.
478874,528121,Молодая девушка держит фен и расчесывает волосы.
24402,521948,Женщина сушит феном комок газет.
212058,489586,Женщина дует на ребенка феном перед столом.
117759,531114,"В зеркале видна женщина, которая сушит волосы."
177262,607500,Кот сидит на стойке в ванной за феном.
126744,260531,"Кухня с микроволновой печью, холодильником и посудомоечной машиной."
245112,424403,Пара зубных щеток в держателе в комнате.
44504,355486,Зубные щетки и другие средства гигиены полости рта.
361282,638785,Часы висят на деревянной стене.
63478,399210,Раковина в ванной с товарами для лица вокруг нее.
208,76457,Игрушечный динозавр стоит на раковине рядом с открытым краном
114303,661558,"Ванная комната с ванной, полками и раковиной."
129001,567359,Ванна рядом с раковиной в ванной комнате.
518287,346953,Зубная щетка стоит в секции зубной пасты в держателе зубной щетки.
466583,587907,Ванная комната со стоячим душем рядом с раковиной и зеркалом.
298732,617549,"коричнево-черная стойка, ванна, зеркало и чашки"
102668,102718,Большой белый автобус проезжает перекресток.
49994,232613,Светофор стоит рядом со стеной здания.
194729,507429,Табличка сбоку от каменной скамьи.
385535,575975,Дорожный знак на видном месте между двумя светофорами.
225093,479825,На рельсах стоит поезд с зеленой и оранжевой полосами.
155451,306282,зеленый свет светофора улица здания и другие огни
57149,68122,Школьный автобус и серебристая машина ждут на железнодорожном переезде.
369482,760970,светофор висит над городской улицей
266451,425346,башня с белыми часами и несколько зданий
449793,149429,Два светофора установлены на столбе на дороге.
307598,736922,желто-зеленый поезд на светофоре.
166391,187245,Большая широкая улица с множеством светофоров.
340654,79780,Светофор и уличные знаки находятся у красного пожарного гидранта.
95063,213868,Светофор с сигналом пешеходного перехода.
258860,110323,Белый велосипед припаркован рядом с коричневой кирпичной стеной.
495379,761932,Крупный план красного пожарного гидранта возле тротуара.
5437,46000,Пожарный гидрант с синей курткой поверх него.
152465,771557,Пожарный гидрант с шиной под ним.
363654,428793,Пожарный гидрант в куче снега рядом с ветхим зданием.
187495,542197,Пожарный гидрант стоит на углу тротуара.
283054,20145,Пожарный гидрант установлен на улице рядом с бордюром.
331223,398370,Красный пожарный гидрант находится рядом с предупредительной перегородкой.
