img_id,caption_id,sent
523194,325096,Пожарный гидрант на обочине дороги.
419080,289150,"Знак рядом с тротуаром с мусорным баком, дорожным конусом и несколькими пожарными гидрантами."
178810,581425,"Желто-красный пожарный гидрант, стоящий рядом с деревом."
511583,470814,Автомобиль припаркован на улице ночью.
13159,85191,"Табличка о том, что рядом есть пожарный гидрант."
117792,224950,Красный пожарный гидрант перед окном с большими окнами.
21671,347518,На тротуаре стоит сломанный розовый пожарный гидрант.
167422,180165,Красный пожарный гидрант стоит у реки с водой.
52005,631253,Желтый пожарный гидрант находится рядом с кустами.
440559,497641,"Желтый пожарный гидрант стоит рядом с люком, из которого выходит пар."
372203,422696,Деревянная скамейка и пожарный гидрант на поле.
274655,686874,автобус с рекламой казино
186322,292307,Посеребренный ржавый пожарный гидрант стоит посреди прохода.
29648,234454,Красный пожарный гидрант на бетонном блоке.
331024,486953,размытое фото желтого пожарного гидранта
451014,552527,Синий и желтый пожарный гидрант стоит на обочине дороги.
6091,784493,Ночью хорошо виден знак «Стоп».
28982,120499,Красный знак «Стоп» на обочине дороги.
305634,79504,Знаки угла улицы над красным знаком «Стоп».
535242,732235,красный знак «Стоп» находится на дороге снаружи
88462,58590,Большой желтый школьный автобус останавливается на дороге.
76648,505982,Знак «Стоп» с различными наклейками.
182469,385219,Знак «Стоп» над баррикадой на дороге.
562737,475228,"знак «Стоп», под которым есть еще один знак, предупреждающий, что движение не останавливается."
66263,622340,Знак «Стоп» в глуши с большими холмистыми холмами.
24629,355610,Красный знак «Стоп» на обочине улицы.
197090,194833,Красный знак «Стоп» на обочине улицы.
503277,152634,Знак «Стоп» рядом с дорожным знаком на обочине дороги.
105291,361790,Знак «Стоп» на углу North Main и Schoolhouse.
79408,402565,Красный знак «Стоп» рядом с лесом.
151231,758215,"Знак стоп с табличкой над ним, на которой написано «David»."
386525,503414,Припаркованный грузовик на стоянке рядом с деревом.
97892,97956,Белый демон парит рядом с красным знаком «Стоп» под знаком улицы с односторонним движением.
391321,644080,уличный фонарь находится рядом со знаком «Стоп»
84168,387809,Знак «Стоп» и пожарный гидрант на углу заросшего травой тротуара.
45966,109995,Знак «Стоп» на иностранном языке
388487,368308,"дикие цветы, растущие рядом со знаком «Стоп»."
239843,521386,Два дорожных знака над знаком остановки.
92244,124125,Кукла в платье стоит между двумя парковочными метрами.
258674,476865,Паркомат лежит криво на улице.
433774,632421,Паркомат рядом с высоким деревом.
348584,609623,"Два парковочных счетчика, засыпанные снегом, видны только их лицевые стороны."
211653,316294,На выставке представлены паркоматы различных типов и размеров.
503252,678894,парковочный счетчик зеленого цвета с надписью «donation station»
37709,147427,На одном столбе висит знак «Стоп» и две таблички с названием улицы.
543985,460476,Паркомат рядом с припаркованным автомобилем.
462677,220627,Синий парковочный счетчик рядом с улицей.
92212,200998,автомобили припаркованы около дорожных знаков
417588,355004,Разноцветный парковочный счетчик перед лестницей.
242345,222039,Окно со стороны здания за парковочным счетчиком.
370448,396585,Пожарный гидрант перед пустым тротуаром.
67757,311794,"Вечером рекламный щит магазина стоит на тротуаре рядом с синей машиной, припаркованной у обочины."
280325,649128,Граффити украшает стену перед парковочным счетчиком.
38186,563755,Грузовик стоит рядом с бордюром с счетчиком.
53994,526101,Симпатичный красно-бело-синий парковочный счетчик у кустов.
288824,128023,пожарная машина едет по городской улице
498533,134725,Уличная сцена со снегом на автомобиле и на земле.
565012,717603,автомобили на шоссе ночью в городе
135023,217683,Паркомат на обочине дороги.
503183,648903,Кукла на шарнирах стоит между двумя парковочными метрами и смотрит.
46144,533747,Скамейка цвета радуги в парке 
220171,231327,Коричневая деревянная скамейка у стены.
109894,159457,часы на столбе на городской улице возле зданий
334311,20826,Скамейка на обочине пустой пешеходной дорожки.
518030,464430,скамейка стоит на корнете с видом на воду
424258,368820,Деревянная скамейка возле двух бочек с цветами.
576927,122793,"Скамейка в парке с двумя камнями, сложенными друг на друга"
453584,706106,На красной скамейке изображен символ Coca-Cola.
57917,507535,Дерево растет на склоне возле скамейки.
147293,702131,"скамейка в парке, вокруг которой растут деревья"
330750,734260,Рядом со старым каменным зданием построена скамейка.
466332,313192,скамейка перед домом с кустами
25430,561120,Скамья с видом на пышную зеленую долину внизу.
18485,115539,Деревянная скамейка стоит в зеленом парке.
28826,284017,"Скамейка, частично засыпанная песком, на пляже у океана."
405248,393890,"Деревянная скамейка, покрытая горшками и контейнерами с растениями."
351589,568063,Деревянная скамейка возле дома.
113128,677548,Скамейка у изгороди недалеко от леса
154168,525100,Автобус проезжает по улице мимо высоких домов.
387388,660086,Скамейка на деревянной доске в воде
555298,543452,Собака спит между сумкой для книг и шредером под компьютерным столом.
111062,262639,Телевизор вмонтирован в стену между двумя полками.
270096,564287,Ноутбук и несколько компьютеров на столе.
50753,482105,"Кухня с духовкой, плитой, раковиной, микроволновой печью и холодильником."
137301,808886,"Стол с ноутбуком, монитором, мышкой и сумкой."
580953,280752,"Стол с ноутбуком, компьютерным монитором и клавиатурой."
406211,344731,Кошка сидит на стуле в гостиной.
128148,107034,Большая гостиная с кожаными диванами и деревянным полом.
142246,76777,Компьютер на столе с четырьмя стульями в эркере.
113556,378445,"Полка в комнате, полной книг"
78107,673218,Кошка сидит перед телевизором и пристально смотрит на него.
225456,786470,кошка рядом с экраном компьютера
363461,948,Компьютерный стол и стул выглядят как домашний офис.
225757,172454,Стол с несколькими компьютерами и сотовыми телефонами.
368684,481768,Комната с телевизором на заднем плане и экраном ноутбука на переднем плане.
499842,429028,компьютерный стол с компьютером и ноутбуком наверху
568879,466981,Один из двух мониторов рядом с ноутбуками включен.
423744,632926,ноутбук и монитор окружены множеством проводов
541664,322728,Ноутбук стоит на столе из лего.
242427,784743,"Комната со столами, ноутбуками и экраном с розеткой."
105538,694538,"Стол с ноутбуком, монитором, клавиатурой, мышью и динамиками."
464196,222534,"Большой экран проектора над столом, покрытым ноутбуками."
135872,27550,Стол с ноутбуком и настольным компьютером.
561403,432664,"На компьютерном столе есть ноутбук, монитор и планшетный ПК."
482970,57954,Ноутбук стоит на столе с динамиком.
71563,331299,"Монитор с большим экраном на столе, подключенный к ноутбуку."
398567,97085,"Стол с компьютером, клавиатурой, мышью, качающейся головой, динамиками и лавовой лампой."
254169,829389,два ноутбука и монитор компьютера стоят рядом друг с другом на столе
253263,100808,Настольные и портативные компьютеры на столе с принтером.
312868,349660,Стол с двумя ноутбуками и компьютерным монитором с клавиатурой.
154423,107513,Черный стол с монитором настольного компьютера и клавиатурой на нем.
430002,127775,крупный план тарелки пиццы возле компьютерной клавиатуры
558012,548589,Компьютерный стол с ноутбуком и настольным компьютером.
217269,151170,изогнутый стол с клавиатурой и монитором на нем
93948,688923,Кошка стоит рядом с тарелкой на компьютере.
248631,35012,Ноутбук с прикрепленной к нему стационарной мышью.
119828,508898,Кот сидит на деревянном столе.
356790,354225,"Коллаж из четырех изображений показывает клавиатуры, мониторы и компьютерные мыши."
20481,733184,Ноутбук стоит на столе.
308117,332727,экран компьютера с клавиатурой и мышью на столе
37367,503293,Ноутбук стоит на столе.
225609,677717,Ноутбук на деревянном столе.
278313,729553,Хоккейная майка лежит на спинке дивана перед телевизором.
550784,408144,Кровать с балдахином в просторной комнате с пуфиком
446881,157129,Гостиная с телевизором в центре и видом на кухню.
7288,95876,Белый унитаз с электронным коричневым сиденьем.
436963,469558,"Клавиатура, мышь и монитор стоят на столе."
333888,484192,гостиная с синими стульями и книжной полкой
95908,178615,Кружка на грелке рядом с мышкой.
272630,324660,Два ноутбука на столе.
505043,432352,компьютерный стол с двумя ноутбуками и монитором сверху
486383,189620,Ноутбук и монитор настольного компьютера на столе.
37740,291975,Деревянный стол с ноутбуком на нем.
413341,99810,Клавиатура ноутбука с тремя маленькими фигурками медведя наверху.
505754,36428,кусок торта на тарелке рядом с чашкой кофе на столе
309424,560783,"Офисная зона с двумя компьютерными мониторами и двумя жесткими чемоданами, установленными на стуле с колесиками."
233638,455665,Ноутбук и мобильный телефон на столе.
427666,665051,Три банана лежат рядом с ноутбуком и мобильными телефонами.
169361,514359,у собаки за головой зеленая фрисби
219632,760037,Черная кудрявая собака играет с фрисби.
528488,145610,собака играет во фрисби на снегу
403315,84923,Хаски несет фрисби в парке.
223032,691970,Собака держит в пасти белую фрисби.
212817,394031,Ребенок на сноуборде спускается по склону.
96625,459091,Мужчина выполняет трюк на лыжах.
207178,792688,Два человека стоят на снегу с лыжами.
392665,713137,Две молодые девушки сидят в снаряжении для сноуборда
297698,736556,Лыжник в прыжке наклоняется вперед.
283186,85074,"Лыжник в шлеме и очках наклоняется, чтобы обойти препятствие."
263223,705288,Мужчина катается на лыжах по заснеженному склону.
414170,280831,"Несколько лыжников скользят по холмистой местности, покрытой снегом."
761,731103,Группа лыжников готовится к спуску с горы.
85813,319423,Пара вместе катается на лыжах с горы.
239235,713366,Группа людей едет вниз по заснеженной лыжной трассе.
112941,508064,Группа людей катается на лыжах по склону заснеженной горы.
247692,568085,Группа мужчин катается на лыжах по склону горнолыжного склона.
526040,743037,Человек на сноуборде упал в снег.
102903,129853,Человек в серой парке сидит на снегу
39988,168641,снимок с низу человека на сноуборде.
451104,338076,Человек стоит на тропинке в снегу.
296906,391836,Сноубордист в синем пальто выполняет воздушный трюк в альпийской зоне.
549683,516110,Мужчина пытается кататься на сноуборде в темноте.
285462,439960,"Женщина держит в одной руке доску для сноуборда, а другую руку в воздухе."
358296,660249,Стойка для сноуборда у подножия лыжного холма возле здания.
209989,786252,несколько людей в снегу
203382,781909,медведь стоит в пруду
1682,694422,Лодка плывет по водоему.
364444,288911,Компьютерный стол с 3 мониторами и ноутбуком.
2139,570325,"Велосипед, прислоненный к неубранной и грязной кровати."
359569,587089,Черно-коричневая собака идет по снегу с красной фрисби во рту.
66568,538013,"Два плюшевых мишки лежат, прислонившись к стене."
153392,662976,Много воздушных змеев поднимаются высоко в облака.
502090,491727,Воздушный змей летит по голубому небу с длинным хвостом.
7784,607568,большой воздушный змей летит высоко в небе.
228025,588888,Воздушный змей летит над песчаным коричневым пляжем.
44478,87628,Воздушный змей в форме самолета летит по воздуху.
384476,426936,Воздушный змей летит в голубом небе.
183416,49508,Воздушный змей в форме павлина летит над головой в голубом небе.
162357,432952,Воздушный змей зацепился за голую ветку дерева.
351621,291302,Два воздушных змея летят высоко в ясном голубом небе.
161752,705085,"Комната с воздушными змеями, свисающими с потолка."
447501,798310,Зелёный воздушный змей-монстр парит в солнечном небе.
132686,411372,Небо наполнено множеством разноцветных воздушных змеев.
187890,777224,Воздушный змей-дракон пролетает перед монументом Вашингтона
216785,307276,Воздушный змей высоко в воздухе на дереве.
550729,202357,Красочный воздушный змей лежит на зеленом поле.
308974,541563,Воздушный змей летит по кристально чистому голубому небу.
395083,121884,Большое количество воздушных змеев в небе
23751,171992,"Статуя человека, держащего воздушного змея, рядом с ребенком."
521719,286536,Крупный план висящих воздушных змеев.
499588,10170,"Разноцветные воздушные змеи, прикрепленные к светло-голубой стене."
450439,84258,"патриотический воздушный змей, летящий по ясному голубому небу."
85911,639356,Воздушный змей плывет посреди большого водоема.
509270,770558,На ветру летают два воздушных змея.
212801,76598,Несколько небольших воздушных змеев в форме дуги летят над океаном
204067,637098,Игрок на домашней базе готовится бить во время игры.
78671,740075,Бейсболист размахивает битой на поле
295006,677652,Бейсболист с битой в руках на поле.
154071,569430,Игроки в действии на бейсбольном поле.
432820,781665,Бейсболист размахивает битой на поле.
8119,165508,Команда молодых людей играет в бейсбол.
115791,15050,Бейсболист стоит на ромбе с поднятой битой.
229984,512532,Бейсболист на домашней базе размахивает битой.
72795,633859,"группа игроков в мяч, играющих на поле перед публикой"
19176,108674,"Поле заполнено бейсболистами, играющими в бейсбол."
297522,615387,Отбивающий замахивается бейсбольной битой с ловцом позади него.
397729,35903,Маленький ребенок размахивает бейсбольной битой во время игры в бейсбол.
318130,724149,Отбивающий ждет броска подачи.
555538,71280,Кетчер в бейсболе с вытянутой рукой.
291209,108577,Мужчина идет по бейсбольному полю в кетчерской перчатке.
456725,395421,Мужчина играет в бейсбол
464087,396465,"Бейсбольный отбивающий совершает мощный удар, а кэтчер и судья смотрят на него."
444502,423693,Человек на поле в бейсбольной перчатке.
231508,149207,Бейсболист бросает бейсбольный мяч на поле.
289076,107737,"Скейтбордист, одетый во все черное, поднимается по деревянной рампе на своей доске."
26518,726263,кто-то стоит на скейтборде
165862,479094,"Группа мужчин, стоящих рядом друг с другом на сцене."
359387,423951,"Ребенок пытается проделать трюк на скейтборде, сидя."
300842,472419,Скейтборд с колесами на полу.
424271,108762,Группа маленьких детей катается на скейтбордах в здании.
360595,345982,Мужчина со скейтбордом разговаривает с мужчиной в шляпе.
63922,587726,Маленький мальчик на скейтборде в шлеме.
202444,473767,Скейтбордист выполняет трюк на цементе со зрителями при дневном свете
168260,672553,Желтый грузовик спасателя стоит на пляже
353909,219206,Синяя доска для серфинга торчит из покрытой зеленой травой земли.
453310,763499,Красный грузовик с фонарями на крыше и оборудованием сзади.
522566,362066,Припаркован очень короткий фургон с прислоненной к нему доской для серфинга.
324189,530458,Доска для серфинга перерабатывается в уникальное кашпо.
495048,174380,Собака на доске для серфинга в кузове грузовика.
164115,202154,Доска для серфинга рядом с тележкой для покупок.
234677,219988,Гигантский Соник стоит на пляже с доской для серфинга.
207027,170290,"Ряд деревянных досок для серфинга, сидящих на стойке на пляже."
6473,346562,Торт на день рождения в виде пляжа с доской для серфинга и пальмами.
572907,495970,Мужчина стоит на теннисном корте с ракеткой.
