img_id,caption_id,root_Tense_error_sent
509270,770558,На ветру летали два воздушных змея.
212801,76598,Несколько небольших воздушных змеев в форме дуги летят над океаном
204067,637098,Игрок на домашней базе готовился бить во время игры.
78671,740075,Бейсболист размахивал битой на поле
432820,781665,Бейсболист размахивал битой на поле.
8119,165508,Команда молодых людей играла в бейсбол.
115791,15050,Бейсболист стоял на ромбе с поднятой битой.
19176,108674,"Поле было заполнено бейсболистами, играющими в бейсбол."
297522,615387,Отбивающий замахивался бейсбольной битой с ловцом позади него.
397729,35903,Маленький ребенок размахивал бейсбольной битой во время игры в бейсбол.
318130,724149,Отбивающий ждал броска подачи.
291209,108577,Мужчина шел по бейсбольному полю в кетчерской перчатке.
456725,395421,Мужчина играл в бейсбол
464087,396465,"Бейсбольный отбивающий совершал мощный удар, а кэтчер и судья смотрели на него."
231508,149207,Бейсболист бросал бейсбольный мяч на поле.
289076,107737,"Скейтбордист, одетый во все черное, поднимался по деревянной рампе на своей доске."
26518,726263,кто-то стоял на скейтборде
359387,423951,"Ребенок пытался проделать трюк на скейтборде, сидя."
424271,108762,Группа маленьких детей каталась на скейтбордах в здании.
360595,345982,Мужчина со скейтбордом разговаривал с мужчиной в шляпе.
202444,473767,Скейтбордист выполнял трюк на цементе со зрителями при дневном свете
168260,672553,Желтый грузовик спасателя стоял на пляже
324189,530458,Доска для серфинга перерабатывалась в уникальное кашпо.
234677,219988,Гигантский Соник стоял на пляже с доской для серфинга.
572907,495970,Мужчина стоял на теннисном корте с ракеткой.
